{
  "packId": "us",
  "country": "US",
  "label": "United States",
  "status": "starter",
  "subnational": {
    "fieldKey": "jurisdiction.stateOrTerritory",
    "label": "State or district",
    "codes": [
      { "code": "AL", "label": "Alabama" },
      { "code": "AK", "label": "Alaska" },
      { "code": "AZ", "label": "Arizona" },
      { "code": "AR", "label": "Arkansas" },
      { "code": "CA", "label": "California" },
      { "code": "CO", "label": "Colorado" },
      { "code": "CT", "label": "Connecticut" },
      { "code": "DE", "label": "Delaware" },
      { "code": "DC", "label": "District of Columbia" },
      { "code": "FL", "label": "Florida" },
      { "code": "GA", "label": "Georgia" },
      { "code": "HI", "label": "Hawaii" },
      { "code": "ID", "label": "Idaho" },
      { "code": "IL", "label": "Illinois" },
      { "code": "IN", "label": "Indiana" },
      { "code": "IA", "label": "Iowa" },
      { "code": "KS", "label": "Kansas" },
      { "code": "KY", "label": "Kentucky" },
      { "code": "LA", "label": "Louisiana" },
      { "code": "ME", "label": "Maine" },
      { "code": "MD", "label": "Maryland" },
      { "code": "MA", "label": "Massachusetts" },
      { "code": "MI", "label": "Michigan" },
      { "code": "MN", "label": "Minnesota" },
      { "code": "MS", "label": "Mississippi" },
      { "code": "MO", "label": "Missouri" },
      { "code": "MT", "label": "Montana" },
      { "code": "NE", "label": "Nebraska" },
      { "code": "NV", "label": "Nevada" },
      { "code": "NH", "label": "New Hampshire" },
      { "code": "NJ", "label": "New Jersey" },
      { "code": "NM", "label": "New Mexico" },
      { "code": "NY", "label": "New York" },
      { "code": "NC", "label": "North Carolina" },
      { "code": "ND", "label": "North Dakota" },
      { "code": "OH", "label": "Ohio" },
      { "code": "OK", "label": "Oklahoma" },
      { "code": "OR", "label": "Oregon" },
      { "code": "PA", "label": "Pennsylvania" },
      { "code": "RI", "label": "Rhode Island" },
      { "code": "SC", "label": "South Carolina" },
      { "code": "SD", "label": "South Dakota" },
      { "code": "TN", "label": "Tennessee" },
      { "code": "TX", "label": "Texas" },
      { "code": "UT", "label": "Utah" },
      { "code": "VT", "label": "Vermont" },
      { "code": "VA", "label": "Virginia" },
      { "code": "WA", "label": "Washington" },
      { "code": "WV", "label": "West Virginia" },
      { "code": "WI", "label": "Wisconsin" },
      { "code": "WY", "label": "Wyoming" }
    ]
  },
  "datasetBindings": [
    {
      "slot": "climate",
      "label": "NOAA layers (indicative)",
      "note": "Starter pointer only — bind via published climate crosswalk; not a live US commercial hub. Do not treat landscapearchive.com as owned."
    }
  ],
  "crosswalks": [
    {
      "label": "US SEC climate disclosure crosswalk",
      "href": "/crosswalk/us-sec-climate"
    }
  ],
  "honesty": "Starter jurisdiction pack. Enables US country + state/DC codes on TLA-185 project.jurisdiction. Does not open a US Archive hub, USD checkout, or US trademark claims."
}
